{
  "schema_version": 1,
  "feature": "structured-finding-layer",
  "phase": "implement",
  "completed_tasks": [],
  "remaining_tasks": [
    {
      "id": "T001",
      "title": "test normalize"
    },
    {
      "id": "T002",
      "title": "impl normalize"
    },
    {
      "id": "T003",
      "title": "test dedup"
    },
    {
      "id": "T004",
      "title": "impl dedup"
    },
    {
      "id": "T005",
      "title": "test buildEnvelope"
    },
    {
      "id": "T006",
      "title": "impl buildEnvelope"
    },
    {
      "id": "T007",
      "title": "test go adapter"
    },
    {
      "id": "T008",
      "title": "impl go adapter"
    },
    {
      "id": "T009",
      "title": "test scan discovery"
    },
    {
      "id": "T010",
      "title": "impl scan discovery"
    },
    {
      "id": "T011",
      "title": "test scan degradation"
    },
    {
      "id": "T012",
      "title": "impl scan degradation"
    },
    {
      "id": "T013",
      "title": "test verify wiring"
    },
    {
      "id": "T014",
      "title": "wire verify"
    }
  ],
  "git_head": "679ea85",
  "timestamp": "2026-07-12T00:00:00Z"
}
